{
  "$schema": "https://json-schema.org/draft/2020-12/schema",
  "$id": "https://example.invalid/teaching-skill-miner/teacher_agent_learning_observation.schema.json",
  "title": "One paired Teaching Agent learning observation",
  "type": "object",
  "required": ["schema", "case_id", "provenance", "pretest", "posttest", "transfer_test", "delayed_test"],
  "properties": {
    "schema": {"const": "teaching_skill_miner.teacher_agent_learning_observation.v1"},
    "case_id": {"type": "string", "pattern": "^[a-z][a-z0-9_]+$"},
    "provenance": {"enum": ["author_constructed_demo_not_real", "teacher_provided_test_record", "authorized_real_learner_observation"]},
    "pretest": {"$ref": "#/$defs/score"},
    "posttest": {"$ref": "#/$defs/score"},
    "transfer_test": {"oneOf": [{"$ref": "#/$defs/score"}, {"type": "null"}]},
    "delayed_test": {"oneOf": [{"$ref": "#/$defs/score"}, {"type": "null"}]}
  },
  "$defs": {
    "score": {
      "type": "object",
      "required": ["earned", "possible"],
      "properties": {
        "earned": {"type": "number", "minimum": 0},
        "possible": {"type": "number", "exclusiveMinimum": 0}
      },
      "additionalProperties": false
    }
  },
  "additionalProperties": false
}
